13358,simple,,,Enameled Cast Iron Dutch Oven LKPOT60049,1,0,visible,"<h3>Key Features</h3><ul><li><strong>Enameled Cast Iron Construction:</strong> Provides superior heat retention and even cooking for braising, roasting, and simmering.</li><li><strong>Versatile Bulk Use:</strong> Ideal for wholesale buyers supplying restaurants and retailers with durable, oven-safe cookware.</li><li><strong>Professional Finish:</strong> Smooth enamel interior resists staining and chipping, ensuring long-lasting performance in high-volume kitchens.</li></ul>","<h2>Enameled Cast Iron Dutch Oven LKPOT60049 – Wholesale Bulk Cookware</h2><p>This enameled cast iron Dutch oven is designed for wholesale buyers seeking high-performance cookware for commercial kitchens and retail shelves. The heavy-duty construction ensures excellent heat distribution and retention, making it perfect for slow-cooking, braising, roasting, and stewing. The enameled finish eliminates the need for seasoning and provides a non-reactive surface that won't absorb flavors or odors. With a tight-fitting lid that locks in moisture, this Dutch oven delivers consistent results batch after batch. Available for bulk order, it is a reliable addition to any kitchen supply inventory, catering to chefs and home cooks who demand professional-grade equipment. The sturdy cast iron body and ergonomic handles offer safe handling, even when fully loaded. Ideal for distributors and retailers specializing in premium kitchen accessories, this Dutch oven combines durability with elegant design, ensuring customer satisfaction and repeat business.</p><h3>Key Features</h3><ul><li><strong>Even Heat Distribution:</strong> Cast iron construction ensures uniform heating for perfect cooking results.</li><li><strong>Oven-Safe Design:</strong> Suitable for use in ovens up to 500°F, expanding cooking versatility.</li><li><strong>Easy Clean Enamel:</strong> Smooth interior resists sticking and cleans easily with soap and water.</li></ul><h3>Specifications</h3><table><tr><th>Spec</th><th>Detail</th></tr><tr><td>Material</td><td>Enameled Cast Iron</td></tr><tr><td>Capacity</td><td>6 Quarts</td></tr><tr><td>Oven Safe</td><td>Up to 500°F</td></tr><tr><td>Lid Type</td><td>Tight-Fitting</td></tr></table>",,,taxable,,1,,,0,0,,,,,0,,,,Cookware > Pots,,,"https://img.leeknives.com/wp-content/uploads/2024/01/LKPOT60049.jpg, https://img.leeknives.com/wp-content/uploads/2024/01/LKPOT60049-2.jpg, https://img.leeknives.com/wp-content/uploads/2024/01/LKPOT60049-3.jpg",,,,,,,,,0,,Cookware Material,Enameled Cast Iron Cookware,0,1,,6,dutch oven wholesale,160,10414,no,,Wholesale Enameled Cast Iron Dutch Oven LKPOT60049,"Premium enameled cast iron Dutch oven for bulk orders. Durable, oven-safe, and perfect for retailers. Order wholesale today."
13360,simple,,,Enameled Cast Iron Fondue Set LKPOT60050-51,1,0,visible,"<h3>Key Features</h3><ul><li><strong>Complete Fondue Set:</strong> Includes enameled cast iron pot, burner, and forks for a versatile entertaining experience.</li><li><strong>Wholesale Ready:</strong> Ideal for bulk orders to kitchen supply stores and specialty retailers.</li><li><strong>Even Heat Retention:</strong> Cast iron ensures consistent melting for cheese, chocolate, or oil fondues.</li></ul>","<h2>Enameled Cast Iron Fondue Set LKPOT60050-51 – Wholesale Bulk Cookware</h2><p>This enameled cast iron fondue set is an excellent choice for wholesale buyers looking to offer a unique entertaining solution. The set includes a durable cast iron pot with a colorful enamel finish, a burner stand, and heat-resistant forks, allowing customers to create interactive dining experiences. The cast iron construction provides superior heat retention, keeping cheese, chocolate, or broth perfectly melted throughout the meal. The enameled interior is easy to clean and resists staining, making it suitable for repeated use. Designed for both home and commercial settings, this fondue set adds a touch of elegance to any table. For retailers and distributors, this product is a strong addition to kitchen accessories inventory, appealing to customers seeking premium entertaining cookware. Available for bulk order, it combines functionality with aesthetic appeal, ensuring high turnover and customer satisfaction.</p><h3>Key Features</h3><ul><li><strong>Complete Set:</strong> Includes pot, burner, and forks for immediate use.</li><li><strong>Even Heat:</strong> Cast iron maintains consistent temperature for perfect fondue.</li><li><strong>Easy Cleanup:</strong> Enameled interior resists sticking and staining.</li></ul><h3>Specifications</h3><table><tr><th>Spec</th><th>Detail</th></tr><tr><td>Material</td><td>Enameled Cast Iron</td></tr><tr><td>Capacity</td><td>1.5 Quarts</td></tr><tr><td>Includes</td><td>Pot, Burner, Forks</td></tr><tr><td>Color Options</td><td>Multiple</td></tr></table>",,,taxable,,1,,,0,0,,,,,0,,,,Cookware > Pots,,,"https://img.leeknives.com/wp-content/uploads/2024/01/LKPOT60050-3.jpg, https://img.leeknives.com/wp-content/uploads/2024/01/LKPOT60050.jpg, https://img.leeknives.com/wp-content/uploads/2024/01/LKPOT60051.jpg, https://img.leeknives.com/wp-content/uploads/2024/01/LKPOT60050-2.jpg",,,,,,,,,0,,Cookware Material,Enameled Cast Iron Cookware,0,1,,6,fondue set wholesale,160,10414,no,,Wholesale Enameled Cast Iron Fondue Set LKPOT60050-51,"Complete fondue set with enameled cast iron pot, burner, and forks. Perfect for bulk orders. Order wholesale today."
13363,simple,,,Enameled Cast Iron Dutch Oven LKPOT60052,1,0,visible,"<h3>Key Features</h3><ul><li><strong>Enameled Cast Iron Build:</strong> Offers excellent heat retention and even cooking for braising and roasting.</li><li><strong>Wholesale Bulk Option:</strong> Ideal for retailers and distributors stocking premium cookware.</li><li><strong>Versatile Use:</strong> Oven-safe and stovetop compatible, suitable for diverse recipes.</li></ul>","<h2>Enameled Cast Iron Dutch Oven LKPOT60052 – Wholesale Bulk Cookware</h2><p>This enameled cast iron Dutch oven is crafted for wholesale buyers seeking reliable, high-performance cookware for commercial and retail distribution. The heavy-duty cast iron body ensures superior heat retention and even distribution, making it ideal for slow-cooking, braising, and roasting. The enamel coating provides a non-reactive surface that does not require seasoning and resists staining, ensuring easy maintenance. The tight-fitting lid seals in moisture and flavor, delivering consistent results. Available for bulk order, this Dutch oven is a versatile addition to any kitchen supply lineup, appealing to chefs and home cooks alike. The sturdy handles offer a secure grip, even when using oven mitts. For distributors and retailers focusing on quality kitchen accessories, this product combines durability with elegant design, ensuring customer satisfaction and repeat orders.</p><h3>Key Features</h3><ul><li><strong>Even Heat Distribution:</strong> Cast iron ensures uniform cooking.</li><li><strong>Oven-Safe:</strong> Safe for oven use up to 500°F.</li><li><strong>Easy Clean:</strong> Enameled interior resists sticking and staining.</li></ul><h3>Specifications</h3><table><tr><th>Spec</th><th>Detail</th></tr><tr><td>Material</td><td>Enameled Cast Iron</td></tr><tr><td>Capacity</td><td>5 Quarts</td></tr><tr><td>Oven Safe</td><td>Up to 500°F</td></tr><tr><td>Lid Type</td><td>Tight-Fitting</td></tr></table>",,,taxable,,1,,,0,0,,,,,0,,,,Cookware > Pots,,,"https://img.leeknives.com/wp-content/uploads/2024/01/LKPOT60052.jpg, https://img.leeknives.com/wp-content/uploads/2024/01/LKPOT60052-2.jpg, https://img.leeknives.com/wp-content/uploads/2024/01/LKPOT60052-4.jpg, https://img.leeknives.com/wp-content/uploads/2024/01/LKPOT60052-5.jpg, https://img.leeknives.com/wp-content/uploads/2024/01/LKPOT60052-3.jpg",,,,,,,,,0,,Cookware Material,Enameled Cast Iron Cookware,0,1,,6,dutch oven bulk,160,10414,no,,Bulk Enameled Cast Iron Dutch Oven LKPOT60052,"Durable enameled cast iron Dutch oven for bulk orders. Even heat, oven-safe, easy clean. Order wholesale today."
13365,simple,,,Enameled Cast Iron Dutch Oven LKPOT60053-55,1,0,visible,<h3>Key Features</h3><ul><li><strong>Enameled Cast Iron Construction:</strong> Provides superior heat retention for slow-cooking and braising.</li><li><strong>Wholesale Bulk Available:</strong> Perfect for retailers and distributors stocking premium cookware.</li><li><strong>Versatile & Durable:</strong> Oven-safe and stovetop compatible with a smooth enamel finish.</li></ul>,"<h2>Enameled Cast Iron Dutch Oven LKPOT60053-55 – Wholesale Bulk Cookware</h2><p>This enameled cast iron Dutch oven is designed for wholesale buyers seeking high-quality cookware for commercial and retail applications. The heavy cast iron body ensures excellent heat retention and even distribution, making it ideal for braising, roasting, and simmering. The enamel coating provides a non-reactive surface that resists staining and chipping, ensuring long-lasting performance. The tight-fitting lid locks in moisture and flavor, delivering tender results every time. Available for bulk order, this Dutch oven is a versatile addition to any kitchen supply inventory, appealing to professional chefs and home cooks. The ergonomic handles offer a secure grip, even when using oven mitts. For distributors and retailers focusing on premium kitchen accessories, this product combines durability with aesthetic appeal, ensuring customer satisfaction and repeat business.</p><h3>Key Features</h3><ul><li><strong>Even Heat:</strong> Cast iron ensures uniform cooking.</li><li><strong>Oven-Safe:</strong> Safe for oven use up to 500°F.</li><li><strong>Easy Clean:</strong> Enameled interior resists sticking.</li></ul><h3>Specifications</h3><table><tr><th>Spec</th><th>Detail</th></tr><tr><td>Material</td><td>Enameled Cast Iron</td></tr><tr><td>Capacity</td><td>6 Quarts</td></tr><tr><td>Oven Safe</td><td>Up to 500°F</td></tr><tr><td>Lid Type</td><td>Tight-Fitting</td></tr></table>",,,taxable,,1,,,0,0,,,,,0,,,,Cookware > Pots,,,"https://img.leeknives.com/wp-content/uploads/2024/01/LKPOT60053.jpg, https://img.leeknives.com/wp-content/uploads/2024/01/LKPOT60054.jpg, https://img.leeknives.com/wp-content/uploads/2024/01/LKPOT60055.jpg",,,,,,,,,0,,Cookware Material,Enameled Cast Iron Cookware,0,1,,6,dutch oven wholesale,160,10414,no,,Wholesale Enameled Cast Iron Dutch Oven LKPOT60053-55,"Premium enameled cast iron Dutch oven for bulk orders. Durable, oven-safe, even heat. Order wholesale today."
13369,simple,,,Enameled Cast Iron Dutch Oven LKPOT60056-57,1,0,visible,<h3>Key Features</h3><ul><li><strong>Enameled Cast Iron Build:</strong> Ensures superior heat retention and even cooking for braising and roasting.</li><li><strong>Wholesale Bulk Option:</strong> Ideal for retailers and distributors stocking premium cookware.</li><li><strong>Versatile Use:</strong> Oven-safe and stovetop compatible with a durable enamel finish.</li></ul>,"<h2>Enameled Cast Iron Dutch Oven LKPOT60056-57 – Wholesale Bulk Cookware</h2><p>This enameled cast iron Dutch oven is crafted for wholesale buyers seeking reliable, high-performance cookware for commercial and retail distribution. The heavy-duty cast iron body ensures excellent heat retention and even distribution, making it perfect for slow-cooking, braising, and roasting. The enamel coating provides a non-reactive surface that does not require seasoning and resists staining, ensuring easy maintenance. The tight-fitting lid seals in moisture and flavor, delivering consistent results. Available for bulk order, this Dutch oven is a versatile addition to any kitchen supply lineup, appealing to chefs and home cooks alike. The sturdy handles offer a secure grip, even when using oven mitts. For distributors and retailers focusing on quality kitchen accessories, this product combines durability with elegant design, ensuring customer satisfaction and repeat orders.</p><h3>Key Features</h3><ul><li><strong>Even Heat Distribution:</strong> Cast iron ensures uniform cooking.</li><li><strong>Oven-Safe:</strong> Safe for oven use up to 500°F.</li><li><strong>Easy Clean:</strong> Enameled interior resists sticking and staining.</li></ul><h3>Specifications</h3><table><tr><th>Spec</th><th>Detail</th></tr><tr><td>Material</td><td>Enameled Cast Iron</td></tr><tr><td>Capacity</td><td>5 Quarts</td></tr><tr><td>Oven Safe</td><td>Up to 500°F</td></tr><tr><td>Lid Type</td><td>Tight-Fitting</td></tr></table>",,,taxable,,1,,,0,0,,,,,0,,,,Cookware > Pots,,,"https://img.leeknives.com/wp-content/uploads/2024/01/LKPOT60056.jpg, https://img.leeknives.com/wp-content/uploads/2024/01/LKPOT60057.jpg, https://img.leeknives.com/wp-content/uploads/2024/01/LKPOT60056-2-1.jpg",,,,,,,,,0,,Cookware Material,Enameled Cast Iron Cookware,0,1,,6,dutch oven bulk,160,10414,no,,Bulk Enameled Cast Iron Dutch Oven LKPOT60056-57,"Durable enameled cast iron Dutch oven for bulk orders. Even heat, oven-safe, easy clean. Order wholesale today."
13372,simple,,,Enameled Cast Iron Dutch Oven LKPOT60058-59,1,0,visible,<h3>Key Features</h3><ul><li><strong>Enameled Cast Iron Construction:</strong> Provides superior heat retention for slow-cooking and braising.</li><li><strong>Wholesale Bulk Available:</strong> Perfect for retailers and distributors stocking premium cookware.</li><li><strong>Versatile & Durable:</strong> Oven-safe and stovetop compatible with a smooth enamel finish.</li></ul>,"<h2>Enameled Cast Iron Dutch Oven LKPOT60058-59 – Wholesale Bulk Cookware</h2><p>This enameled cast iron Dutch oven is designed for wholesale buyers seeking high-quality cookware for commercial and retail applications. The heavy cast iron body ensures excellent heat retention and even distribution, making it ideal for braising, roasting, and simmering. The enamel coating provides a non-reactive surface that resists staining and chipping, ensuring long-lasting performance. The tight-fitting lid locks in moisture and flavor, delivering tender results every time. Available for bulk order, this Dutch oven is a versatile addition to any kitchen supply inventory, appealing to professional chefs and home cooks. The ergonomic handles offer a secure grip, even when using oven mitts. For distributors and retailers focusing on premium kitchen accessories, this product combines durability with aesthetic appeal, ensuring customer satisfaction and repeat business.</p><h3>Key Features</h3><ul><li><strong>Even Heat:</strong> Cast iron ensures uniform cooking.</li><li><strong>Oven-Safe:</strong> Safe for oven use up to 500°F.</li><li><strong>Easy Clean:</strong> Enameled interior resists sticking.</li></ul><h3>Specifications</h3><table><tr><th>Spec</th><th>Detail</th></tr><tr><td>Material</td><td>Enameled Cast Iron</td></tr><tr><td>Capacity</td><td>6 Quarts</td></tr><tr><td>Oven Safe</td><td>Up to 500°F</td></tr><tr><td>Lid Type</td><td>Tight-Fitting</td></tr></table>",,,taxable,,1,,,0,0,,,,,0,,,,Cookware > Pots,,,"https://img.leeknives.com/wp-content/uploads/2024/01/LKPOT60059.jpg, https://img.leeknives.com/wp-content/uploads/2024/01/LKPOT60058-3.jpg, https://img.leeknives.com/wp-content/uploads/2024/01/LKPOT60058.jpg, https://img.leeknives.com/wp-content/uploads/2024/01/LKPOT60058-2.jpg, https://img.leeknives.com/wp-content/uploads/2024/01/LKPOT60058-4.jpg",,,,,,,,,0,,Cookware Material,Enameled Cast Iron Cookware,0,1,,6,dutch oven wholesale,160,10414,no,,Wholesale Enameled Cast Iron Dutch Oven LKPOT60058-59,"Premium enameled cast iron Dutch oven for bulk orders. Durable, oven-safe, even heat. Order wholesale today."
13375,simple,,,Enameled Cast Iron Dutch Oven LKPOT60060-61,1,0,visible,<h3>Key Features</h3><ul><li><strong>Enameled Cast Iron Build:</strong> Ensures superior heat retention and even cooking for braising and roasting.</li><li><strong>Wholesale Bulk Option:</strong> Ideal for retailers and distributors stocking premium cookware.</li><li><strong>Versatile Use:</strong> Oven-safe and stovetop compatible with a durable enamel finish.</li></ul>,"<h2>Enameled Cast Iron Dutch Oven LKPOT60060-61 – Wholesale Bulk Cookware</h2><p>This enameled cast iron Dutch oven is crafted for wholesale buyers seeking reliable, high-performance cookware for commercial and retail distribution. The heavy-duty cast iron body ensures excellent heat retention and even distribution, making it perfect for slow-cooking, braising, and roasting. The enamel coating provides a non-reactive surface that does not require seasoning and resists staining, ensuring easy maintenance. The tight-fitting lid seals in moisture and flavor, delivering consistent results. Available for bulk order, this Dutch oven is a versatile addition to any kitchen supply lineup, appealing to chefs and home cooks alike. The sturdy handles offer a secure grip, even when using oven mitts. For distributors and retailers focusing on quality kitchen accessories, this product combines durability with elegant design, ensuring customer satisfaction and repeat orders.</p><h3>Key Features</h3><ul><li><strong>Even Heat Distribution:</strong> Cast iron ensures uniform cooking.</li><li><strong>Oven-Safe:</strong> Safe for oven use up to 500°F.</li><li><strong>Easy Clean:</strong> Enameled interior resists sticking and staining.</li></ul><h3>Specifications</h3><table><tr><th>Spec</th><th>Detail</th></tr><tr><td>Material</td><td>Enameled Cast Iron</td></tr><tr><td>Capacity</td><td>5 Quarts</td></tr><tr><td>Oven Safe</td><td>Up to 500°F</td></tr><tr><td>Lid Type</td><td>Tight-Fitting</td></tr></table>",,,taxable,,1,,,0,0,,,,,0,,,,Cookware > Pots,,,"https://img.leeknives.com/wp-content/uploads/2024/01/LKPOT60060.jpg, https://img.leeknives.com/wp-content/uploads/2024/01/LKPOT60061.jpg, https://img.leeknives.com/wp-content/uploads/2024/01/LKPOT60060-4.jpg, https://img.leeknives.com/wp-content/uploads/2024/01/LKPOT60060-2.jpg, https://img.leeknives.com/wp-content/uploads/2024/01/LKPOT60060-3.jpg",,,,,,,,,0,,Cookware Material,Enameled Cast Iron Cookware,0,1,,6,dutch oven bulk,160,10414,no,,Bulk Enameled Cast Iron Dutch Oven LKPOT60060-61,"Durable enameled cast iron Dutch oven for bulk orders. Even heat, oven-safe, easy clean. Order wholesale today."
