10540,simple,,,Cast Iron Double Dutch Oven LKPOT60010,1,0,visible,"<h3>Key Features</h3><ul><li><strong>Double Duty:</strong> Pot and lid both function as cookware.</li><li><strong>Bare Cast Iron:</strong> Excellent heat retention and natural seasoning.</li><li><strong>Versatile Cooking:</strong> Ideal for roasting, frying, and baking.</li></ul>","<h2>Cast Iron Double Dutch Oven LKPOT60010</h2><p>This cast iron double Dutch oven offers exceptional versatility for wholesale buyers. The deep pot is perfect for slow-cooking stews, soups, and braises, while the lid flips over to serve as a skillet for frying, searing, or baking. Constructed from bare cast iron, it provides superior heat retention and develops a natural nonstick seasoning with use. Its round shape ensures even heat distribution, and the tight-fitting lid locks in moisture for tender results. Compatible with all heat sources, including induction, ovens, and campfires, this two-in-one pot is ideal for both indoor and outdoor cooking. Sturdy side handles offer a secure grip, even when hot. Available in bulk quantities, it is perfect for retailers, restaurant suppliers, and distributors. The dual-purpose design appeals to customers seeking space-saving cookware without compromising on performance.</p><h3>Key Features</h3><ul><li><strong>Two-in-One:</strong> Pot and skillet combination.</li><li><strong>Natural Seasoning:</strong> Nonstick surface improves over time.</li><li><strong>Multi-Heat Use:</strong> Works on stovetop, oven, and campfire.</li></ul><h3>Specifications</h3><table><tr><th>Spec</th><th>Detail</th></tr><tr><td>Material</td><td>Cast Iron (bare)</td></tr><tr><td>Shape</td><td>Round</td></tr><tr><td>Lid Function</td><td>Converts to skillet</td></tr><tr><td>Oven Safe</td><td>Yes</td></tr></table>",,,taxable,,1,,,0,0,,,,,0,,,,Cookware > Pots,,,"https://img.leeknives.com/wp-content/uploads/2023/06/Cast-Iron-Double-Dutch-Oven-LKPOT60010.jpg, https://img.leeknives.com/wp-content/uploads/2023/06/LKPOT60010-1.jpg, https://img.leeknives.com/wp-content/uploads/2023/06/LKPOT60010-2.jpg, https://img.leeknives.com/wp-content/uploads/2023/06/LKPOT60010-3.jpg, https://img.leeknives.com/wp-content/uploads/2023/06/LKPOT60010-4.jpg",,,,,,,,,0,,Cookware Material,Cast Iron Cookware,0,1,,7,double dutch oven,160,10414,no,,Cast Iron Double Dutch Oven Wholesale LKPOT60010,"Double Dutch oven for bulk orders. Pot and skillet in one, even heat, durable. Order wholesale today."
13302,simple,,,Cast Iron Dutch Oven with Wood Lid LKPOT60011,1,0,visible,<h3>Key Features</h3><ul><li><strong>Wood Lid:</strong> Adds rustic charm and insulation for heat retention.</li><li><strong>Bare Cast Iron:</strong> Provides durability and natural nonstick seasoning.</li><li><strong>Versatile Use:</strong> Ideal for serving and cooking.</li></ul>,"<h2>Cast Iron Dutch Oven with Wood Lid LKPOT60011</h2><p>This cast iron Dutch oven with a wood lid offers a unique blend of rustic aesthetics and functional performance. The wood lid provides natural insulation, helping to retain heat and moisture during cooking, while the bare cast iron base ensures excellent heat distribution and develops a natural nonstick seasoning over time. Perfect for slow-cooking stews, soups, and roasts, this Dutch oven is also ideal for serving directly at the table. Compatible with all heat sources, including induction and ovens, it offers versatility for both cooking and presentation. The wood lid adds a decorative touch that appeals to customers seeking stylish kitchen accessories. Available in wholesale quantities, this product is perfect for retailers, gift shops, and distributors. Its durable construction and unique design make it a standout item in any cookware lineup.</p><h3>Key Features</h3><ul><li><strong>Wood Lid:</strong> Natural insulation and aesthetic appeal.</li><li><strong>Cast Iron Base:</strong> Even heat and natural seasoning.</li><li><strong>Dual Use:</strong> Cook and serve in one pot.</li></ul><h3>Specifications</h3><table><tr><th>Spec</th><th>Detail</th></tr><tr><td>Material</td><td>Cast Iron (bare) with wood lid</td></tr><tr><td>Lid</td><td>Wood</td></tr><tr><td>Oven Safe</td><td>Yes (base only)</td></tr><tr><td>Stovetop Compatibility</td><td>All types including induction</td></tr></table>",,,taxable,,1,,,0,0,,,,,0,,,,Cookware > Pots,,,"https://img.leeknives.com/wp-content/uploads/2024/01/LKPOT60011.jpg, https://img.leeknives.com/wp-content/uploads/2024/01/LKPOT60011-2.jpg, https://img.leeknives.com/wp-content/uploads/2024/01/LKPOT60011-3.jpg",,,,,,,,,0,,Cookware Material,Cast Iron Cookware,0,1,,6,dutch oven with wood lid,160,10414,no,,Cast Iron Dutch Oven with Wood Lid Wholesale LKPOT60011,"Cast iron Dutch oven with wood lid for bulk orders. Rustic design, even heat, durable. Order wholesale today."
13304,simple,,,Cast Iron Potjie Pot 3-Legged Dutch Oven LKPOT60012,1,0,visible,<h3>Key Features</h3><ul><li><strong>Three-Legged Design:</strong> Traditional Potjie pot for campfire cooking.</li><li><strong>Bare Cast Iron:</strong> Superior heat retention and natural seasoning.</li><li><strong>Authentic South African Style:</strong> Ideal for outdoor stews and slow-cooking.</li></ul>,"<h2>Cast Iron Potjie Pot 3-Legged Dutch Oven LKPOT60012</h2><p>This three-legged cast iron Potjie pot is a traditional Dutch oven designed for authentic outdoor cooking. Featuring three sturdy legs for stable placement over coals or a campfire, it is perfect for slow-cooking stews, soups, and potjiekos. The bare cast iron construction ensures excellent heat retention and develops a natural nonstick seasoning over time. Its tight-fitting lid locks in moisture and flavor, producing tender results for bulk meals. Compatible with campfires, charcoal, and stovetops, this versatile pot is a favorite among outdoor cooking enthusiasts. Available in wholesale quantities, it is ideal for retailers, camping gear stores, and distributors. The durable build withstands rugged conditions, offering long-lasting performance. Stock this essential cookware to meet the demands of customers seeking traditional, high-quality outdoor cooking tools.</p><h3>Key Features</h3><ul><li><strong>Three Legs:</strong> Stable over coals or campfires.</li><li><strong>Natural Seasoning:</strong> Nonstick surface improves with use.</li><li><strong>Multi-Heat Use:</strong> Works on campfire, stove, and oven.</li></ul><h3>Specifications</h3><table><tr><th>Spec</th><th>Detail</th></tr><tr><td>Material</td><td>Cast Iron (bare)</td></tr><tr><td>Legs</td><td>3 integrated legs</td></tr><tr><td>Lid</td><td>Tight-fitting cast iron</td></tr><tr><td>Style</td><td>Potjie pot</td></tr></table>",,,taxable,,1,,,0,0,,,,,0,,,,Cookware > Pots,,,"https://img.leeknives.com/wp-content/uploads/2024/01/LKPOT60012.jpg, https://img.leeknives.com/wp-content/uploads/2024/01/LKPOT60012-2-1.jpg",,,,,,,,,0,,Cookware Material,Cast Iron Cookware,0,1,,6,potjie pot,160,10414,no,,Cast Iron Potjie Pot 3-Legged Dutch Oven Wholesale LKPOT60012,"Traditional 3-legged cast iron Potjie pot for bulk orders. Perfect for campfire cooking, even heat. Order wholesale today."
13307,simple,,,Cast Iron Camp Dutch Oven LKPOT60013,1,0,visible,<h3>Key Features</h3><ul><li><strong>Camp-Ready Design:</strong> Built for outdoor cooking over coals or campfires.</li><li><strong>Bare Cast Iron:</strong> Provides durability and natural nonstick seasoning.</li><li><strong>Legs and Lid:</strong> Integrated legs for stability and a flanged lid for holding coals.</li></ul>,"<h2>Cast Iron Camp Dutch Oven LKPOT60013</h2><p>This cast iron camp Dutch oven is designed for outdoor cooking enthusiasts and wholesale buyers serving the camping market. Featuring three integrated legs for stable placement over coals and a flanged lid that holds hot coals for even top heat, it is ideal for baking, stewing, and frying in the wilderness. The bare cast iron construction ensures excellent heat retention and develops a natural nonstick seasoning over time. Its sturdy wire handle allows for easy suspension over a fire or transport. Compatible with campfires, charcoal, and stovetops, this versatile pot is a staple for outdoor kitchens. Available in wholesale quantities, it is perfect for retailers targeting campers, hunters, and outdoor cooking fans. The durable build withstands rugged conditions, making it a long-lasting addition to any cookware collection. Stock this essential for customers who demand reliability in the great outdoors.</p><h3>Key Features</h3><ul><li><strong>Three Legs:</strong> Provides stability over coals or campfires.</li><li><strong>Flanged Lid:</strong> Holds coals for even top-down heating.</li><li><strong>Wire Handle:</strong> Easy to carry or hang over fire.</li></ul><h3>Specifications</h3><table><tr><th>Spec</th><th>Detail</th></tr><tr><td>Material</td><td>Cast Iron (bare)</td></tr><tr><td>Legs</td><td>3 integrated legs</td></tr><tr><td>Lid</td><td>Flanged for coals</td></tr><tr><td>Handle</td><td>Wire handle</td></tr></table>",,,taxable,,1,,,0,0,,,,,0,,,,Cookware > Pots,,,"https://img.leeknives.com/wp-content/uploads/2024/01/LKPOT60013.jpg, https://img.leeknives.com/wp-content/uploads/2024/01/LKPOT60013-3.jpg, https://img.leeknives.com/wp-content/uploads/2024/01/LKPOT60013-4.jpg, https://img.leeknives.com/wp-content/uploads/2024/01/LKPOT60013-2.png",,,,,,,,,0,,Cookware Material,Cast Iron Cookware,0,1,,6,camp dutch oven,160,10414,no,,Cast Iron Camp Dutch Oven Wholesale LKPOT60013,Camp-ready cast iron Dutch oven for bulk orders. Legs and flanged lid for outdoor cooking. Order wholesale today.
13310,simple,,,Enameled Cast Iron Tagine LKPOT60014-16,1,0,visible,"<h3>Key Features</h3><ul><li><strong>Traditional Tagine Shape:</strong> Conical lid promotes moisture circulation for tender dishes.</li><li><strong>Enameled Cast Iron:</strong> Combines durability with easy cleaning and chip resistance.</li><li><strong>Versatile Use:</strong> Oven-safe and compatible with all stovetops, including induction.</li></ul>","<h2>Enameled Cast Iron Tagine LKPOT60014-16</h2><p>This enameled cast iron tagine brings authentic North African cooking to your wholesale cookware lineup. The distinctive conical lid promotes steam circulation, returning moisture to the pot for tender, flavorful stews, meats, and vegetables. The enamel coating ensures easy food release and simple cleanup, while the cast iron core provides even heat distribution and retention. Compatible with all stovetops, including induction, and oven-safe for versatile cooking, this tagine is a functional and decorative piece. Its vibrant finish adds aesthetic appeal to any kitchen, making it a popular choice for retailers and gift shops. Available in wholesale quantities, this tagine is perfect for distributors, restaurant suppliers, and kitchenware stores. The durable construction withstands daily use, offering long-lasting performance. Stock this unique cookware to attract customers seeking authentic global cuisine tools.</p><h3>Key Features</h3><ul><li><strong>Conical Lid:</strong> Enhances moisture circulation for tender results.</li><li><strong>Enamel Finish:</strong> Non-reactive and easy to clean.</li><li><strong>Induction Compatible:</strong> Works on all stovetop types.</li></ul><h3>Specifications</h3><table><tr><th>Spec</th><th>Detail</th></tr><tr><td>Material</td><td>Enameled Cast Iron</td></tr><tr><td>Shape</td><td>Tagine with conical lid</td></tr><tr><td>Oven Safe</td><td>Yes</td></tr><tr><td>Stovetop Compatibility</td><td>All types including induction</td></tr></table>",,,taxable,,1,,,0,0,,,,,0,,,,Cookware > Pots,,,"https://img.leeknives.com/wp-content/uploads/2024/01/LKPOT60014.jpg, https://img.leeknives.com/wp-content/uploads/2024/01/LKPOT60015.jpg, https://img.leeknives.com/wp-content/uploads/2024/01/LKPOT60017.jpg, https://img.leeknives.com/wp-content/uploads/2024/01/LKPOT60014-1.jpg",,,,,,,,,0,,Cookware Material,Enameled Cast Iron Cookware,0,1,,6,enameled cast iron tagine,160,10414,no,,Enameled Cast Iron Tagine Wholesale LKPOT60014-16,"Enameled cast iron tagine for bulk orders. Conical lid for tender dishes, induction safe. Order wholesale today."
13314,simple,,,Enameled Cast Iron Tagine LKPOT60018,1,0,visible,"<h3>Key Features</h3><ul><li><strong>Traditional Tagine Shape:</strong> Conical lid promotes moisture circulation for tender dishes.</li><li><strong>Enameled Cast Iron:</strong> Combines durability with easy cleaning and chip resistance.</li><li><strong>Versatile Use:</strong> Oven-safe and compatible with all stovetops, including induction.</li></ul>","<h2>Enameled Cast Iron Tagine LKPOT60018</h2><p>This enameled cast iron tagine brings authentic North African cooking to your wholesale cookware lineup. The distinctive conical lid promotes steam circulation, returning moisture to the pot for tender, flavorful stews, meats, and vegetables. The enamel coating ensures easy food release and simple cleanup, while the cast iron core provides even heat distribution and retention. Compatible with all stovetops, including induction, and oven-safe for versatile cooking, this tagine is a functional and decorative piece. Its vibrant finish adds aesthetic appeal to any kitchen, making it a popular choice for retailers and gift shops. Available in wholesale quantities, this tagine is perfect for distributors, restaurant suppliers, and kitchenware stores. The durable construction withstands daily use, offering long-lasting performance. Stock this unique cookware to attract customers seeking authentic global cuisine tools.</p><h3>Key Features</h3><ul><li><strong>Conical Lid:</strong> Enhances moisture circulation for tender results.</li><li><strong>Enamel Finish:</strong> Non-reactive and easy to clean.</li><li><strong>Induction Compatible:</strong> Works on all stovetop types.</li></ul><h3>Specifications</h3><table><tr><th>Spec</th><th>Detail</th></tr><tr><td>Material</td><td>Enameled Cast Iron</td></tr><tr><td>Shape</td><td>Tagine with conical lid</td></tr><tr><td>Oven Safe</td><td>Yes</td></tr><tr><td>Stovetop Compatibility</td><td>All types including induction</td></tr></table>",,,taxable,,1,,,0,0,,,,,0,,,,Cookware > Pots,,,"https://img.leeknives.com/wp-content/uploads/2024/01/LKPOT60018.jpg, https://img.leeknives.com/wp-content/uploads/2024/01/LKPOT60014-1.jpg",,,,,,,,,0,,Cookware Material,Enameled Cast Iron Cookware,0,1,,6,enameled cast iron tagine,160,10414,no,,Enameled Cast Iron Tagine Wholesale LKPOT60018,"Enameled cast iron tagine for bulk orders. Conical lid for tender dishes, induction safe. Order wholesale today."
13316,simple,,,Enameled Cast Iron Double Dutch Oven LKPOT60021,1,0,visible,"<h3>Key Features</h3><ul><li><strong>Material:</strong> Premium enameled cast iron for superior heat retention and even cooking.</li><li><strong>Versatility:</strong> Doubles as a Dutch oven and a skillet lid, perfect for braising, baking, and roasting.</li><li><strong>Durability:</strong> Colorful enamel finish resists chipping and cracking, ideal for high-volume kitchen use.</li></ul>","<h2>Enameled Cast Iron Double Dutch Oven LKPOT60021</h2><p>This enameled cast iron double Dutch oven is a versatile addition to any professional kitchen. Crafted from heavy-gauge cast iron, it provides exceptional heat retention and distribution, ensuring consistent cooking results for soups, stews, bread, and more. The double design includes a deep pot and a shallow lid that can be used as a separate skillet, maximizing functionality. The vibrant enamel coating not only adds aesthetic appeal but also protects the iron from rust and makes cleaning effortless. Ideal for retailers and distributors offering high-quality cookware to restaurants and culinary enthusiasts, this pot is built to withstand frequent use. Its sturdy handles ensure safe lifting, even when fully loaded. Available for wholesale bulk orders, this double Dutch oven meets the demands of busy commercial kitchens while maintaining an elegant presentation for retail shelves.</p><h3>Key Features</h3><ul><li><strong>Material:</strong> Enameled cast iron for superior heat retention and even cooking.</li><li><strong>Design:</strong> Double Dutch oven with a lid that doubles as a skillet.</li><li><strong>Durability:</strong> Chip-resistant enamel coating for long-lasting performance.</li></ul><h3>Specifications</h3><table><tr><th>Spec</th><th>Detail</th></tr><tr><td>Material</td><td>Enameled Cast Iron</td></tr><tr><td>Capacity</td><td>6 Quarts</td></tr><tr><td>Compatibility</td><td>All stovetops including induction</td></tr><tr><td>Oven Safe</td><td>Up to 500°F</td></tr></table>",,,taxable,,1,,,0,0,,,,,0,,,,Cookware > Pots,,,"https://img.leeknives.com/wp-content/uploads/2024/01/LKPOT60021.jpg, https://img.leeknives.com/wp-content/uploads/2024/01/LKPOT60021-3.png, https://img.leeknives.com/wp-content/uploads/2024/01/LKPOT60021-2.jpg, https://img.leeknives.com/wp-content/uploads/2024/01/LKPOT60021-4.jpg",,,,,,,,,0,,Cookware Material,Enameled Cast Iron Cookware,0,1,,7,double Dutch oven,160,10414,no,,Enameled Cast Iron Double Dutch Oven Wholesale LKPOT60021,"Premium enameled cast iron double Dutch oven for wholesale. Durable, versatile, and induction-compatible. Order wholesale today."
13318,simple,,,Enameled Cast Iron Heart Dutch Oven LKPOT60024-25,1,0,visible,"<h3>Key Features</h3><ul><li><strong>Design:</strong> Charming heart shape, perfect for special occasions and retail gift displays.</li><li><strong>Material:</strong> Heavy-duty enameled cast iron ensures even heat distribution and retention.</li><li><strong>Versatility:</strong> Suitable for braising, baking, and serving directly to the table.</li></ul>","<h2>Enameled Cast Iron Heart Dutch Oven LKPOT60024-25</h2><p>This enameled cast iron heart Dutch oven combines functionality with a unique aesthetic, making it a standout product for kitchenware retailers. Its heart-shaped design appeals to consumers looking for specialty cookware for gifts or romantic meals. Constructed from premium cast iron, it offers excellent heat retention and even cooking, ideal for slow-cooked dishes, soups, and baked goods. The enameled interior is non-reactive and easy to clean, while the exterior resists chipping. The tight-fitting lid locks in moisture and flavor. Available in multiple sizes (LKPOT60024 and LKPOT60025), this Dutch oven is perfect for wholesalers targeting boutique stores and online retailers. Its sturdy handles provide a secure grip, and it is compatible with all stovetops, including induction. Order in bulk to meet seasonal demand for heart-shaped cookware.</p><h3>Key Features</h3><ul><li><strong>Design:</strong> Unique heart shape for specialty retail appeal.</li><li><strong>Material:</strong> Enameled cast iron for durability and heat performance.</li><li><strong>Versatility:</strong> Works on all stovetops and in the oven.</li></ul><h3>Specifications</h3><table><tr><th>Spec</th><th>Detail</th></tr><tr><td>Material</td><td>Enameled Cast Iron</td></tr><tr><td>Capacity</td><td>2-3 Quarts (varies by model)</td></tr><tr><td>Compatibility</td><td>All stovetops including induction</td></tr><tr><td>Oven Safe</td><td>Up to 450°F</td></tr></table>",,,taxable,,1,,,0,0,,,,,0,,,,Cookware > Pots,,,"https://img.leeknives.com/wp-content/uploads/2024/01/LKPOT60025.jpg, https://img.leeknives.com/wp-content/uploads/2024/01/LKPOT60024.jpg, https://img.leeknives.com/wp-content/uploads/2024/01/LKPOT60024-2.jpg, https://img.leeknives.com/wp-content/uploads/2024/01/LKPOT60024-3.jpg, https://img.leeknives.com/wp-content/uploads/2024/01/LKPOT60024-4.jpg",,,,,,,,,0,,Cookware Material,Enameled Cast Iron Cookware,0,1,,7,heart Dutch oven,160,10414,no,,Enameled Cast Iron Heart Dutch Oven Wholesale LKPOT60024-25,Unique enameled cast iron heart Dutch oven for wholesale. Perfect for gifts and specialty retail. Order wholesale today.
13322,simple,,,Enameled Cast Iron Dutch Oven LKPOT60026-28,1,0,visible,"<h3>Key Features</h3><ul><li><strong>Material:</strong> Premium enameled cast iron for superior heat retention and even cooking.</li><li><strong>Versatility:</strong> Ideal for braising, roasting, baking, and simmering.</li><li><strong>Durability:</strong> Chip-resistant enamel finish ensures long-lasting performance in commercial settings.</li></ul>","<h2>Enameled Cast Iron Dutch Oven LKPOT60026-28</h2><p>This enameled cast iron Dutch oven is a workhorse for any professional kitchen. Available in multiple capacities (LKPOT60026, LKPOT60027, LKPOT60028), it offers flexibility for chefs preparing large batches of soups, stews, or braised meats. The heavy-gauge cast iron construction ensures even heat distribution, eliminating hot spots. The enamel coating provides a non-reactive cooking surface that resists staining and is easy to clean. A tight-fitting lid traps moisture and flavor, enhancing dish quality. Compatible with all stovetops, including induction, and oven-safe up to 500°F, this pot is a versatile tool for restaurants and catering businesses. Its robust handles allow for safe transport, even when full. Perfect for wholesale bulk orders, this Dutch oven meets the rigorous demands of high-volume cooking while maintaining an attractive appearance for retail display.</p><h3>Key Features</h3><ul><li><strong>Material:</strong> Enameled cast iron for even heat and durability.</li><li><strong>Versatility:</strong> Suitable for all cooking methods from stovetop to oven.</li><li><strong>Durability:</strong> Chip-resistant enamel for long-term use.</li></ul><h3>Specifications</h3><table><tr><th>Spec</th><th>Detail</th></tr><tr><td>Material</td><td>Enameled Cast Iron</td></tr><tr><td>Capacity</td><td>4-6 Quarts (varies by model)</td></tr><tr><td>Compatibility</td><td>All stovetops including induction</td></tr><tr><td>Oven Safe</td><td>Up to 500°F</td></tr></table>",,,taxable,,1,,,0,0,,,,,0,,,,Cookware > Pots,,,"https://img.leeknives.com/wp-content/uploads/2024/01/LKPOT60026.jpg, https://img.leeknives.com/wp-content/uploads/2024/01/LKPOT60027.jpg, https://img.leeknives.com/wp-content/uploads/2024/01/LKPOT60028.jpg",,,,,,,,,0,,Cookware Material,Enameled Cast Iron Cookware,0,1,,6,enameled cast iron Dutch oven,160,10414,no,,Enameled Cast Iron Dutch Oven Wholesale LKPOT60026-28,"Durable enameled cast iron Dutch oven for wholesale. Even heat, chip-resistant, induction-compatible. Order wholesale today."
13326,simple,,,Enameled Cast Iron Fondue Set LKPOT60032,1,0,visible,"<h3>Key Features</h3><ul><li><strong>Design:</strong> Complete fondue set with pot, burner, and forks for entertaining.</li><li><strong>Material:</strong> Enameled cast iron for even heat distribution and retention.</li><li><strong>Versatility:</strong> Perfect for cheese, chocolate, or oil fondue.</li></ul>","<h2>Enameled Cast Iron Fondue Set LKPOT60032</h2><p>This enameled cast iron fondue set is an excellent addition to any kitchenware retail lineup, appealing to customers who enjoy interactive dining experiences. The set includes a fondue pot, burner, and forks, all crafted from high-quality enameled cast iron for superior heat retention. The pot's enamel coating ensures easy cleaning and resistance to staining, while the burner provides controlled heat for consistent melting. Ideal for cheese, chocolate, or oil fondue, this set is perfect for parties and special occasions. The cast iron construction guarantees durability, making it suitable for both home and commercial use. Its classic design fits various decor styles, enhancing table presentation. Available for wholesale bulk orders, this fondue set is a must-have for retailers targeting the entertaining and gourmet cooking market.</p><h3>Key Features</h3><ul><li><strong>Design:</strong> Complete set for fondue enjoyment.</li><li><strong>Material:</strong> Enameled cast iron for even heat.</li><li><strong>Versatility:</strong> Suitable for cheese, chocolate, or oil fondue.</li></ul><h3>Specifications</h3><table><tr><th>Spec</th><th>Detail</th></tr><tr><td>Material</td><td>Enameled Cast Iron</td></tr><tr><td>Capacity</td><td>1.5 Quarts</td></tr><tr><td>Includes</td><td>Pot, burner, and forks</td></tr><tr><td>Compatibility</td><td>Burner only</td></tr></table>",,,taxable,,1,,,0,0,,,,,0,,,,Cookware > Pots,,,"https://img.leeknives.com/wp-content/uploads/2024/01/LKPOT60032-2.jpg, https://img.leeknives.com/wp-content/uploads/2024/01/LKPOT60032-3.jpg, https://img.leeknives.com/wp-content/uploads/2024/01/LKPOT60032.jpg",,,,,,,,,0,,Cookware Material,Enameled Cast Iron Cookware,0,1,,6,cast iron fondue set,160,10414,no,,Enameled Cast Iron Fondue Set Wholesale LKPOT60032,"Complete enameled cast iron fondue set for wholesale. Includes pot, burner, forks. Perfect for entertaining. Order wholesale today."
