13331,simple,,,Enameled Cast Iron Oval Dutch Oven LKPOT60033,1,0,visible,"<h3>Key Features</h3><ul><li><strong>Design:</strong> Oval shape for roasting large cuts of meat and poultry.</li><li><strong>Material:</strong> Enameled cast iron for even heat and moisture retention.</li><li><strong>Versatility:</strong> Ideal for braising, roasting, and serving.</li></ul>","<h2>Enameled Cast Iron Oval Dutch Oven LKPOT60033</h2><p>This enameled cast iron oval Dutch oven is designed to accommodate larger roasts and poultry, making it a favorite among professional chefs and home cooks alike. Its oval shape provides ample space for whole chickens, briskets, and other elongated cuts, while the cast iron construction ensures even heat distribution and superior retention. The enamel coating is non-reactive and easy to clean, resisting stains and odors. A tight-fitting lid seals in moisture, resulting in tender, flavorful dishes. Compatible with all stovetops, including induction, and oven-safe, this Dutch oven transitions seamlessly from stove to oven to table. Its sturdy handles allow for secure lifting. Ideal for wholesale bulk orders, this pot is a versatile addition to any kitchenware retailer's inventory, appealing to customers seeking high-performance cookware for roasting and braising.</p><h3>Key Features</h3><ul><li><strong>Design:</strong> Oval shape for large roasts and poultry.</li><li><strong>Material:</strong> Enameled cast iron for even heat.</li><li><strong>Versatility:</strong> Suitable for stovetop, oven, and table service.</li></ul><h3>Specifications</h3><table><tr><th>Spec</th><th>Detail</th></tr><tr><td>Material</td><td>Enameled Cast Iron</td></tr><tr><td>Capacity</td><td>6 Quarts</td></tr><tr><td>Compatibility</td><td>All stovetops including induction</td></tr><tr><td>Oven Safe</td><td>Up to 500°F</td></tr></table>",,,taxable,,1,,,0,0,,,,,0,,,,Cookware > Pots,,,"https://img.leeknives.com/wp-content/uploads/2024/01/LKPOT60033.jpg, https://img.leeknives.com/wp-content/uploads/2024/01/LKPOT60033-2-1.jpg",,,,,,,,,0,,Cookware Material,Enameled Cast Iron Cookware,0,1,,6,oval Dutch oven,160,10414,no,,Enameled Cast Iron Oval Dutch Oven Wholesale LKPOT60033,Versatile enameled cast iron oval Dutch oven for wholesale. Perfect for roasts and braising. Order wholesale today.
13333,simple,,,Enameled Cast Iron Dutch Oven LKPOT60034,1,0,visible,"<h3>Key Features</h3><ul><li><strong>Material:</strong> Premium enameled cast iron for excellent heat retention.</li><li><strong>Versatility:</strong> Ideal for braising, baking, and simmering.</li><li><strong>Durability:</strong> Chip-resistant enamel finish for long-lasting use.</li></ul>","<h2>Enameled Cast Iron Dutch Oven LKPOT60034</h2><p>This enameled cast iron Dutch oven is a reliable workhorse for any kitchen, offering exceptional heat retention and even cooking. Its heavy-gauge cast iron construction ensures consistent results for soups, stews, bread, and more. The enamel coating provides a non-reactive surface that resists chipping and staining, making it easy to clean. A tight-fitting lid locks in moisture and flavor, enhancing dish quality. Compatible with all stovetops, including induction, and oven-safe, this pot is versatile for various cooking methods. Its sturdy handles ensure safe lifting, even when full. Ideal for wholesale bulk orders, this Dutch oven meets the demands of both home cooks and professional chefs, making it a staple for kitchenware retailers and distributors.</p><h3>Key Features</h3><ul><li><strong>Material:</strong> Enameled cast iron for even heat.</li><li><strong>Versatility:</strong> Suitable for multiple cooking methods.</li><li><strong>Durability:</strong> Chip-resistant enamel for longevity.</li></ul><h3>Specifications</h3><table><tr><th>Spec</th><th>Detail</th></tr><tr><td>Material</td><td>Enameled Cast Iron</td></tr><tr><td>Capacity</td><td>5 Quarts</td></tr><tr><td>Compatibility</td><td>All stovetops including induction</td></tr><tr><td>Oven Safe</td><td>Up to 500°F</td></tr></table>",,,taxable,,1,,,0,0,,,,,0,,,,Cookware > Pots,,,"https://img.leeknives.com/wp-content/uploads/2024/01/LKPOT60034.jpg, https://img.leeknives.com/wp-content/uploads/2024/01/LKPOT60034-2.jpg, https://img.leeknives.com/wp-content/uploads/2024/01/LKPOT60034-3.jpg",,,,,,,,,0,,Cookware Material,Enameled Cast Iron Cookware,0,1,,6,enameled cast iron pot,160,10414,no,,Enameled Cast Iron Dutch Oven Wholesale LKPOT60034,"Durable enameled cast iron Dutch oven for wholesale. Even heat, chip-resistant, induction-safe. Order wholesale today."
13335,simple,,,Enameled Cast Iron Tomato Dutch Oven LKPOT60035,1,0,visible,"<h3>Key Features</h3><ul><li><strong>Design:</strong> Unique tomato shape for eye-catching presentation.</li><li><strong>Material:</strong> Enameled cast iron for even heat distribution.</li><li><strong>Versatility:</strong> Perfect for serving sauces, soups, and stews.</li></ul>","<h2>Enameled Cast Iron Tomato Dutch Oven LKPOT60035</h2><p>This enameled cast iron tomato Dutch oven adds a playful yet elegant touch to any kitchen. Its unique tomato shape makes it a conversation piece, ideal for serving tomato-based sauces, soups, and stews. Crafted from premium cast iron, it offers excellent heat retention and even cooking, ensuring consistent results. The enamel coating is non-reactive and easy to clean, while the tight-fitting lid locks in moisture and flavor. Compatible with all stovetops, including induction, and oven-safe, this pot is versatile for various cooking methods. Its sturdy handles provide a secure grip. Perfect for wholesale bulk orders, this novelty Dutch oven appeals to retailers targeting home cooks and gift buyers looking for distinctive, high-quality cookware.</p><h3>Key Features</h3><ul><li><strong>Design:</strong> Novelty tomato shape for visual appeal.</li><li><strong>Material:</strong> Enameled cast iron for heat performance.</li><li><strong>Versatility:</strong> Suitable for stovetop, oven, and table service.</li></ul><h3>Specifications</h3><table><tr><th>Spec</th><th>Detail</th></tr><tr><td>Material</td><td>Enameled Cast Iron</td></tr><tr><td>Capacity</td><td>2 Quarts</td></tr><tr><td>Compatibility</td><td>All stovetops including induction</td></tr><tr><td>Oven Safe</td><td>Up to 450°F</td></tr></table>",,,taxable,,1,,,0,0,,,,,0,,,,Cookware > Pots,,,"https://img.leeknives.com/wp-content/uploads/2024/01/LKPOT60035.jpg, https://img.leeknives.com/wp-content/uploads/2024/01/LKPOT60035-3.jpg, https://img.leeknives.com/wp-content/uploads/2024/01/LKPOT60035-2.jpg",,,,,,,,,0,,Cookware Material,Enameled Cast Iron Cookware,0,1,,6,tomato Dutch oven,160,10414,no,,Enameled Cast Iron Tomato Dutch Oven Wholesale LKPOT60035,"Unique enameled cast iron tomato Dutch oven for wholesale. Fun design, high performance. Order wholesale today."
13337,simple,,,Enameled Cast Iron Petal Dutch Oven LKPOT60036,1,0,visible,"<h3>Key Features</h3><ul><li><strong>Design:</strong> Elegant petal-shaped lid for decorative appeal.</li><li><strong>Material:</strong> Enameled cast iron for superior heat retention.</li><li><strong>Versatility:</strong> Ideal for braising, baking, and serving.</li></ul>","<h2>Enameled Cast Iron Petal Dutch Oven LKPOT60036</h2><p>This enameled cast iron petal Dutch oven combines functionality with artistry, featuring a beautifully sculpted lid that mimics flower petals. Its elegant design makes it a standout piece for serving directly at the table, while the cast iron construction ensures exceptional heat retention and even cooking. The enamel coating is non-reactive and easy to clean, resisting stains and odors. A tight-fitting lid traps moisture, enhancing flavor in braised dishes and stews. Compatible with all stovetops, including induction, and oven-safe, this pot is versatile for various cooking methods. Its sturdy handles allow for safe transport. Ideal for wholesale bulk orders, this petal Dutch oven appeals to retailers catering to customers who appreciate both form and function in their cookware.</p><h3>Key Features</h3><ul><li><strong>Design:</strong> Petal-shaped lid for decorative presentation.</li><li><strong>Material:</strong> Enameled cast iron for heat performance.</li><li><strong>Versatility:</strong> Suitable for stovetop, oven, and table service.</li></ul><h3>Specifications</h3><table><tr><th>Spec</th><th>Detail</th></tr><tr><td>Material</td><td>Enameled Cast Iron</td></tr><tr><td>Capacity</td><td>3 Quarts</td></tr><tr><td>Compatibility</td><td>All stovetops including induction</td></tr><tr><td>Oven Safe</td><td>Up to 450°F</td></tr></table>",,,taxable,,1,,,0,0,,,,,0,,,,Cookware > Pots,,,"https://img.leeknives.com/wp-content/uploads/2024/01/LKPOT60036.jpg, https://img.leeknives.com/wp-content/uploads/2024/01/LKPOT60036-4.jpg, https://img.leeknives.com/wp-content/uploads/2024/01/LKPOT60036-2.jpg, https://img.leeknives.com/wp-content/uploads/2024/01/LKPOT60036-3.jpg",,,,,,,,,0,,Cookware Material,Enameled Cast Iron Cookware,0,1,,6,petal Dutch oven,160,10414,no,,Enameled Cast Iron Petal Dutch Oven Wholesale LKPOT60036,Elegant enameled cast iron petal Dutch oven for wholesale. Decorative and functional. Order wholesale today.
13339,simple,,,Enameled Cast Iron Dutch Oven LKPOT60037,1,0,visible,"<h3>Key Features</h3><ul><li><strong>Material:</strong> Premium enameled cast iron for even heat distribution.</li><li><strong>Versatility:</strong> Ideal for braising, roasting, and baking.</li><li><strong>Durability:</strong> Chip-resistant enamel finish for long-lasting use.</li></ul>","<h2>Enameled Cast Iron Dutch Oven LKPOT60037</h2><p>This enameled cast iron Dutch oven is a versatile and durable addition to any kitchen. Its heavy-gauge cast iron construction provides excellent heat retention and even cooking, making it perfect for soups, stews, and braised dishes. The enamel coating is non-reactive and easy to clean, resisting chips and stains. A tight-fitting lid locks in moisture and flavor, enhancing dish quality. Compatible with all stovetops, including induction, and oven-safe, this pot transitions seamlessly from stove to oven to table. Its sturdy handles ensure safe lifting, even when full. Ideal for wholesale bulk orders, this Dutch oven meets the needs of both home cooks and professional chefs, making it a reliable choice for kitchenware retailers and distributors.</p><h3>Key Features</h3><ul><li><strong>Material:</strong> Enameled cast iron for even heat.</li><li><strong>Versatility:</strong> Suitable for multiple cooking methods.</li><li><strong>Durability:</strong> Chip-resistant enamel for longevity.</li></ul><h3>Specifications</h3><table><tr><th>Spec</th><th>Detail</th></tr><tr><td>Material</td><td>Enameled Cast Iron</td></tr><tr><td>Capacity</td><td>5 Quarts</td></tr><tr><td>Compatibility</td><td>All stovetops including induction</td></tr><tr><td>Oven Safe</td><td>Up to 500°F</td></tr></table>",,,taxable,,1,,,0,0,,,,,0,,,,Cookware > Pots,,,"https://img.leeknives.com/wp-content/uploads/2024/01/LKPOT60037.jpg, https://img.leeknives.com/wp-content/uploads/2024/01/LKPOT60037-2.jpg, https://img.leeknives.com/wp-content/uploads/2024/01/LKPOT60037-3.jpg",,,,,,,,,0,,Cookware Material,Enameled Cast Iron Cookware,0,1,,6,enameled cast iron pot,160,10414,no,,Enameled Cast Iron Dutch Oven Wholesale LKPOT60037,"Reliable enameled cast iron Dutch oven for wholesale. Even heat, chip-resistant, induction-safe. Order wholesale today."
13341,simple,,,Enameled Cast Iron Dutch Oven LKPOT60038,1,0,visible,"<h3>Key Features</h3><ul><li><strong>Material:</strong> Premium enameled cast iron for superior heat retention.</li><li><strong>Versatility:</strong> Ideal for braising, baking, and simmering.</li><li><strong>Durability:</strong> Chip-resistant enamel finish for long-lasting performance.</li></ul>","<h2>Enameled Cast Iron Dutch Oven LKPOT60038</h2><p>This enameled cast iron Dutch oven is designed for high-performance cooking in both home and professional kitchens. Its heavy-gauge cast iron construction ensures even heat distribution and excellent retention, making it ideal for slow-cooked dishes, bread baking, and more. The enamel coating is non-reactive and easy to clean, resisting stains and odors. A tight-fitting lid seals in moisture, enhancing flavor. Compatible with all stovetops, including induction, and oven-safe, this pot is versatile for various cooking methods. Its sturdy handles provide a secure grip. Perfect for wholesale bulk orders, this Dutch oven is a staple for kitchenware retailers, offering durability and performance that customers trust.</p><h3>Key Features</h3><ul><li><strong>Material:</strong> Enameled cast iron for even heat.</li><li><strong>Versatility:</strong> Suitable for stovetop, oven, and table service.</li><li><strong>Durability:</strong> Chip-resistant enamel for longevity.</li></ul><h3>Specifications</h3><table><tr><th>Spec</th><th>Detail</th></tr><tr><td>Material</td><td>Enameled Cast Iron</td></tr><tr><td>Capacity</td><td>6 Quarts</td></tr><tr><td>Compatibility</td><td>All stovetops including induction</td></tr><tr><td>Oven Safe</td><td>Up to 500°F</td></tr></table>",,,taxable,,1,,,0,0,,,,,0,,,,Cookware > Pots,,,"https://img.leeknives.com/wp-content/uploads/2024/01/LKPOT60038.jpg, https://img.leeknives.com/wp-content/uploads/2024/01/LKPOT60038-2.jpg, https://img.leeknives.com/wp-content/uploads/2024/01/LKPOT60038-3.jpg, https://img.leeknives.com/wp-content/uploads/2024/01/LKPOT60038-4.jpg",,,,,,,,,0,,Cookware Material,Enameled Cast Iron Cookware,0,1,,6,enameled cast iron pot,160,10414,no,,Enameled Cast Iron Dutch Oven Wholesale LKPOT60038,"High-performance enameled cast iron Dutch oven for wholesale. Durable, even heat, induction-safe. Order wholesale today."
13343,simple,,,Enameled Cast Iron Dutch Oven LKPOT60039-41,1,0,visible,"<h3>Key Features</h3><ul><li><strong>Material:</strong> Premium enameled cast iron for excellent heat retention.</li><li><strong>Versatility:</strong> Ideal for braising, roasting, and baking.</li><li><strong>Durability:</strong> Chip-resistant enamel finish for long-lasting use.</li></ul>","<h2>Enameled Cast Iron Dutch Oven LKPOT60039-41</h2><p>This enameled cast iron Dutch oven is available in multiple capacities (LKPOT60039, LKPOT60040, LKPOT60041), offering flexibility for various cooking needs. Its heavy-gauge cast iron construction ensures even heat distribution and superior retention, ideal for soups, stews, and braised dishes. The enamel coating is non-reactive and easy to clean, resisting chips and stains. A tight-fitting lid locks in moisture and flavor, enhancing dish quality. Compatible with all stovetops, including induction, and oven-safe, this pot is versatile for different cooking methods. Its sturdy handles allow for safe transport. Perfect for wholesale bulk orders, this Dutch oven meets the demands of both home cooks and professional chefs, making it a reliable choice for kitchenware retailers.</p><h3>Key Features</h3><ul><li><strong>Material:</strong> Enameled cast iron for even heat.</li><li><strong>Versatility:</strong> Suitable for multiple cooking methods.</li><li><strong>Durability:</strong> Chip-resistant enamel for longevity.</li></ul><h3>Specifications</h3><table><tr><th>Spec</th><th>Detail</th></tr><tr><td>Material</td><td>Enameled Cast Iron</td></tr><tr><td>Capacity</td><td>4-6 Quarts (varies by model)</td></tr><tr><td>Compatibility</td><td>All stovetops including induction</td></tr><tr><td>Oven Safe</td><td>Up to 500°F</td></tr></table>",,,taxable,,1,,,0,0,,,,,0,,,,Cookware > Pots,,,"https://img.leeknives.com/wp-content/uploads/2024/01/LKPOT60039.jpg, https://img.leeknives.com/wp-content/uploads/2024/01/LKPOT60040.jpg, https://img.leeknives.com/wp-content/uploads/2024/01/LKPOT60041.jpg, https://img.leeknives.com/wp-content/uploads/2024/01/LKPOT60039-2.jpg, https://img.leeknives.com/wp-content/uploads/2024/01/LKPOT60039-3.jpg, https://img.leeknives.com/wp-content/uploads/2024/01/LKPOT60039-4.jpg",,,,,,,,,0,,Cookware Material,Enameled Cast Iron Cookware,0,1,,6,enameled cast iron Dutch oven,160,10414,no,,Enameled Cast Iron Dutch Oven Wholesale LKPOT60039-41,"Versatile enameled cast iron Dutch oven for wholesale. Multiple sizes, even heat, induction-safe. Order wholesale today."
13347,simple,,,Enameled Cast Iron Dutch Oven LKPOT60042-43,1,0,visible,"<h3>Key Features</h3><ul><li><strong>Material:</strong> Premium enameled cast iron for superior heat retention.</li><li><strong>Versatility:</strong> Ideal for braising, baking, and simmering.</li><li><strong>Durability:</strong> Chip-resistant enamel finish for long-lasting performance.</li></ul>","<h2>Enameled Cast Iron Dutch Oven LKPOT60042-43</h2><p>This enameled cast iron Dutch oven is available in two capacities (LKPOT60042 and LKPOT60043), providing options for different cooking requirements. Its heavy-gauge cast iron construction ensures even heat distribution and excellent retention, making it perfect for slow-cooked dishes, bread baking, and more. The enamel coating is non-reactive and easy to clean, resisting stains and odors. A tight-fitting lid seals in moisture, enhancing flavor. Compatible with all stovetops, including induction, and oven-safe, this pot is versatile for various cooking methods. Its sturdy handles provide a secure grip. Ideal for wholesale bulk orders, this Dutch oven is a staple for kitchenware retailers, offering durability and performance that customers trust.</p><h3>Key Features</h3><ul><li><strong>Material:</strong> Enameled cast iron for even heat.</li><li><strong>Versatility:</strong> Suitable for stovetop, oven, and table service.</li><li><strong>Durability:</strong> Chip-resistant enamel for longevity.</li></ul><h3>Specifications</h3><table><tr><th>Spec</th><th>Detail</th></tr><tr><td>Material</td><td>Enameled Cast Iron</td></tr><tr><td>Capacity</td><td>5-7 Quarts (varies by model)</td></tr><tr><td>Compatibility</td><td>All stovetops including induction</td></tr><tr><td>Oven Safe</td><td>Up to 500°F</td></tr></table>",,,taxable,,1,,,0,0,,,,,0,,,,Cookware > Pots,,,"https://img.leeknives.com/wp-content/uploads/2024/01/LKPOT60042.jpg, https://img.leeknives.com/wp-content/uploads/2024/01/LKPOT60043.jpg, https://img.leeknives.com/wp-content/uploads/2024/01/LKPOT60042-3.jpg, https://img.leeknives.com/wp-content/uploads/2024/01/LKPOT60042-4.jpg, https://img.leeknives.com/wp-content/uploads/2024/01/LKPOT60042-2.jpg",,,,,,,,,0,,Cookware Material,Enameled Cast Iron Cookware,0,1,,6,enameled cast iron pot,160,10414,no,,Enameled Cast Iron Dutch Oven Wholesale LKPOT60042-43,"Durable enameled cast iron Dutch oven for wholesale. Even heat, chip-resistant, induction-safe. Order wholesale today."
13350,simple,,,Enameled Cast Iron Dutch Oven LKPOT60044,1,0,visible,"<h3>Key Features</h3><ul><li><strong>Material:</strong> Premium enameled cast iron for excellent heat retention.</li><li><strong>Versatility:</strong> Ideal for braising, roasting, and baking.</li><li><strong>Durability:</strong> Chip-resistant enamel finish for long-lasting use.</li></ul>","<h2>Enameled Cast Iron Dutch Oven LKPOT60044</h2><p>This enameled cast iron Dutch oven is a versatile and durable addition to any kitchen. Its heavy-gauge cast iron construction provides excellent heat retention and even cooking, making it perfect for soups, stews, and braised dishes. The enamel coating is non-reactive and easy to clean, resisting chips and stains. A tight-fitting lid locks in moisture and flavor, enhancing dish quality. Compatible with all stovetops, including induction, and oven-safe, this pot transitions seamlessly from stove to oven to table. Its sturdy handles ensure safe lifting, even when full. Ideal for wholesale bulk orders, this Dutch oven meets the needs of both home cooks and professional chefs, making it a reliable choice for kitchenware retailers and distributors.</p><h3>Key Features</h3><ul><li><strong>Material:</strong> Enameled cast iron for even heat.</li><li><strong>Versatility:</strong> Suitable for multiple cooking methods.</li><li><strong>Durability:</strong> Chip-resistant enamel for longevity.</li></ul><h3>Specifications</h3><table><tr><th>Spec</th><th>Detail</th></tr><tr><td>Material</td><td>Enameled Cast Iron</td></tr><tr><td>Capacity</td><td>5 Quarts</td></tr><tr><td>Compatibility</td><td>All stovetops including induction</td></tr><tr><td>Oven Safe</td><td>Up to 500°F</td></tr></table>",,,taxable,,1,,,0,0,,,,,0,,,,Cookware > Pots,,,"https://img.leeknives.com/wp-content/uploads/2024/01/LKPOT60044.jpg, https://img.leeknives.com/wp-content/uploads/2024/01/LKPOT60044-2-1.jpg",,,,,,,,,0,,Cookware Material,Enameled Cast Iron Cookware,0,1,,6,enameled cast iron pot,160,10414,no,,Enameled Cast Iron Dutch Oven Wholesale LKPOT60044,"Reliable enameled cast iron Dutch oven for wholesale. Even heat, chip-resistant, induction-safe. Order wholesale today."
13352,simple,,,Enameled Cast Iron Dutch Oven LKPOT60045,1,0,visible,"<h3>Key Features</h3><ul><li><strong>Material:</strong> Premium enameled cast iron for superior heat retention.</li><li><strong>Versatility:</strong> Ideal for braising, baking, and simmering.</li><li><strong>Durability:</strong> Chip-resistant enamel finish for long-lasting performance.</li></ul>","<h2>Enameled Cast Iron Dutch Oven LKPOT60045</h2><p>This enameled cast iron Dutch oven is designed for high-performance cooking in both home and professional kitchens. Its heavy-gauge cast iron construction ensures even heat distribution and excellent retention, making it ideal for slow-cooked dishes, bread baking, and more. The enamel coating is non-reactive and easy to clean, resisting stains and odors. A tight-fitting lid seals in moisture, enhancing flavor. Compatible with all stovetops, including induction, and oven-safe, this pot is versatile for various cooking methods. Its sturdy handles provide a secure grip. Perfect for wholesale bulk orders, this Dutch oven is a staple for kitchenware retailers, offering durability and performance that customers trust.</p><h3>Key Features</h3><ul><li><strong>Material:</strong> Enameled cast iron for even heat.</li><li><strong>Versatility:</strong> Suitable for stovetop, oven, and table service.</li><li><strong>Durability:</strong> Chip-resistant enamel for longevity.</li></ul><h3>Specifications</h3><table><tr><th>Spec</th><th>Detail</th></tr><tr><td>Material</td><td>Enameled Cast Iron</td></tr><tr><td>Capacity</td><td>6 Quarts</td></tr><tr><td>Compatibility</td><td>All stovetops including induction</td></tr><tr><td>Oven Safe</td><td>Up to 500°F</td></tr></table>",,,taxable,,1,,,0,0,,,,,0,,,,Cookware > Pots,,,"https://img.leeknives.com/wp-content/uploads/2024/01/LKPOT60045.jpg, https://img.leeknives.com/wp-content/uploads/2024/01/LKPOT60045-2.jpg, https://img.leeknives.com/wp-content/uploads/2024/01/LKPOT60045-3.jpg, https://img.leeknives.com/wp-content/uploads/2024/01/LKPOT60045-4.jpg",,,,,,,,,0,,Cookware Material,Enameled Cast Iron Cookware,0,1,,6,enameled cast iron pot,160,10414,no,,Enameled Cast Iron Dutch Oven Wholesale LKPOT60045,"High-performance enameled cast iron Dutch oven for wholesale. Durable, even heat, induction-safe. Order wholesale today."
13354,simple,,,Enameled Cast Iron Dutch Oven LKPOT60046-48,1,0,visible,"<h3>Key Features</h3><ul><li><strong>Material:</strong> Premium enameled cast iron for excellent heat retention.</li><li><strong>Versatility:</strong> Ideal for braising, roasting, and baking.</li><li><strong>Durability:</strong> Chip-resistant enamel finish for long-lasting use.</li></ul>","<h2>Enameled Cast Iron Dutch Oven LKPOT60046-48</h2><p>This enameled cast iron Dutch oven is available in multiple capacities (LKPOT60046, LKPOT60047, LKPOT60048), offering flexibility for various cooking needs. Its heavy-gauge cast iron construction ensures even heat distribution and superior retention, ideal for soups, stews, and braised dishes. The enamel coating is non-reactive and easy to clean, resisting chips and stains. A tight-fitting lid locks in moisture and flavor, enhancing dish quality. Compatible with all stovetops, including induction, and oven-safe, this pot is versatile for different cooking methods. Its sturdy handles allow for safe transport. Perfect for wholesale bulk orders, this Dutch oven meets the demands of both home cooks and professional chefs, making it a reliable choice for kitchenware retailers.</p><h3>Key Features</h3><ul><li><strong>Material:</strong> Enameled cast iron for even heat.</li><li><strong>Versatility:</strong> Suitable for multiple cooking methods.</li><li><strong>Durability:</strong> Chip-resistant enamel for longevity.</li></ul><h3>Specifications</h3><table><tr><th>Spec</th><th>Detail</th></tr><tr><td>Material</td><td>Enameled Cast Iron</td></tr><tr><td>Capacity</td><td>4-6 Quarts (varies by model)</td></tr><tr><td>Compatibility</td><td>All stovetops including induction</td></tr><tr><td>Oven Safe</td><td>Up to 500°F</td></tr></table>",,,taxable,,1,,,0,0,,,,,0,,,,Cookware > Pots,,,"https://img.leeknives.com/wp-content/uploads/2024/01/LKPOT60046.jpg, https://img.leeknives.com/wp-content/uploads/2024/01/LKPOT60047.jpg, https://img.leeknives.com/wp-content/uploads/2024/01/LKPOT60048.jpg, https://img.leeknives.com/wp-content/uploads/2024/01/LKPOT60046-2.jpg, https://img.leeknives.com/wp-content/uploads/2024/01/LKPOT60046-3.jpg, https://img.leeknives.com/wp-content/uploads/2024/01/LKPOT60046-4.jpg, https://img.leeknives.com/wp-content/uploads/2024/01/LKPOT60046-5.jpg",,,,,,,,,0,,Cookware Material,Enameled Cast Iron Cookware,0,1,,6,enameled cast iron Dutch oven,160,10414,no,,Enameled Cast Iron Dutch Oven Wholesale LKPOT60046-48,"Versatile enameled cast iron Dutch oven for wholesale. Multiple sizes, even heat, induction-safe. Order wholesale today."
