ID,Type,SKU,"GTIN, UPC, EAN, or ISBN",Name,Published,Is featured?,Visibility in catalog,Short description,Description,Date sale price starts,Date sale price ends,Tax status,Tax class,In stock?,Stock,Low stock amount,Backorders allowed?,Sold individually?,Weight (oz),Length (in),Width (in),Height (in),Allow customer reviews?,Purchase note,Sale price,Regular price,Categories,Tags,Shipping class,Images,Download limit,Download expiry days,Parent,Grouped products,Upsells,Cross-sells,External URL,Button text,Position,Brands,Attribute 1 name,Attribute 1 value(s),Attribute 1 visible,Attribute 1 global,Meta: stackable_optimized_css,Meta: rank_math_seo_score,Meta: rank_math_focus_keyword,Meta: rank_math_primary_product_cat,Meta: _dwps_table,Meta: _wcsob_hide,Meta: rank_math_primary_product_brand,Meta: rank_math_title,Meta: rank_math_description
10482,simple,,,Enameled Cast Iron Dutch Oven LKPOT60001,1,0,visible,"<h3>Key Features</h3><ul><li><strong>Durable Enamel Coating:</strong> Chip-resistant and easy to clean, suitable for daily commercial use.</li><li><strong>Even Heat Distribution:</strong> Cast iron core ensures consistent cooking results for bulk meal preparation.</li><li><strong>Versatile Use:</strong> Oven-safe up to 500°F, compatible with all stovetops including induction.</li></ul>","<h2>Enameled Cast Iron Dutch Oven LKPOT60001</h2><p>This enameled cast iron Dutch oven is an essential bulk kitchen accessory for professional kitchens and retail stores. Designed for wholesale buyers, it offers superior heat retention and even distribution, making it ideal for braising, roasting, and simmering large quantities. The vibrant enamel finish not only adds aesthetic appeal but also protects the cast iron from rust, ensuring long-lasting durability. Each unit is crafted with a tight-fitting lid that locks in moisture and flavor, perfect for creating stews, soups, and casseroles. The sturdy side handles provide a secure grip, even when using oven mitts. Available in various sizes to meet your inventory needs, this Dutch oven is compatible with all cooktops, including induction, and is oven-safe for versatile cooking methods. Its easy-to-clean interior simplifies maintenance in high-volume settings. Order wholesale to stock a premium product that appeals to both home cooks and culinary professionals seeking reliable performance.</p><h3>Key Features</h3><ul><li><strong>Premium Enamel Finish:</strong> Resists chipping and staining, maintaining a pristine appearance.</li><li><strong>Even Heating:</strong> Cast iron construction eliminates hot spots for consistent results.</li><li><strong>Induction Compatible:</strong> Works on gas, electric, ceramic, and induction stovetops.</li></ul><h3>Specifications</h3><table><tr><th>Spec</th><th>Detail</th></tr><tr><td>Material</td><td>Enameled Cast Iron</td></tr><tr><td>Oven Safe</td><td>Up to 500°F</td></tr><tr><td>Stovetop Compatibility</td><td>All types including induction</td></tr><tr><td>Lid</td><td>Tight-fitting enameled cast iron</td></tr></table>",,,taxable,,1,,,0,0,,,,,0,,,,Cookware > Pots,,,"https://img.leeknives.com/wp-content/uploads/2023/06/Enameled-Cast-Iron-Dutch-Oven-LKPOT60001.jpg, https://img.leeknives.com/wp-content/uploads/2023/06/LKPOT60001.jpg",,,,,,,,,0,,Cookware Material,Enameled Cast Iron Cookware,0,1,,6,enameled cast iron dutch oven,160,10414,no,,Enameled Cast Iron Dutch Oven Wholesale LKPOT60001,"Premium enameled cast iron Dutch oven for bulk orders. Even heat, induction compatible. Durable and easy to clean. Order wholesale today."
10486,simple,,,Enameled Cast Iron Pumpkin Dutch Oven LKPOT60002,1,0,visible,"<h3>Key Features</h3><ul><li><strong>Festive Pumpkin Design:</strong> Unique shape appeals to seasonal and gift markets, boosting retail sales.</li><li><strong>Enameled Cast Iron:</strong> Combines durability with a colorful, chip-resistant exterior.</li><li><strong>Multi-Purpose Cooking:</strong> Ideal for soups, stews, and baking, with even heat retention.</li></ul>","<h2>Enameled Cast Iron Pumpkin Dutch Oven LKPOT60002</h2><p>Add seasonal flair to your cookware lineup with this enameled cast iron pumpkin Dutch oven. Perfect for wholesale buyers targeting fall-themed kitchen accessories, this pot features a distinctive pumpkin shape that doubles as a serving dish. The enamel coating ensures easy release and simple cleaning, while the cast iron core provides exceptional heat retention for slow-cooking and braising. Its tight-fitting lid traps moisture, enhancing flavor development in dishes like chili, casseroles, and bread. Compatible with all stovetops, including induction, and oven-safe for versatile cooking, this Dutch oven is a standout product for retailers. The sturdy handles offer a secure grip, even when hot. Available in bulk quantities, this item is ideal for seasonal promotions or year-round novelty sales. Its durable construction withstands daily use in commercial settings, making it a practical choice for restaurants and catering businesses. Stock this eye-catching piece to attract customers seeking both function and festive design.</p><h3>Key Features</h3><ul><li><strong>Unique Shape:</strong> Pumpkin design enhances presentation and marketability.</li><li><strong>Enamel Coating:</strong> Protects against rust and simplifies cleanup.</li><li><strong>Even Heat:</strong> Cast iron ensures uniform cooking for consistent results.</li></ul><h3>Specifications</h3><table><tr><th>Spec</th><th>Detail</th></tr><tr><td>Material</td><td>Enameled Cast Iron</td></tr><tr><td>Oven Safe</td><td>Up to 500°F</td></tr><tr><td>Stovetop Compatibility</td><td>All types including induction</td></tr><tr><td>Design</td><td>Pumpkin shape</td></tr></table>",,,taxable,,1,,,0,0,,,,,0,,,,Cookware > Pots,,,"https://img.leeknives.com/wp-content/uploads/2023/06/Enameled-Cast-Iron-Pumpkin-Dutch-Oven-LKPOT60002.jpg, https://img.leeknives.com/wp-content/uploads/2023/06/LKPOT60002-1.jpg, https://img.leeknives.com/wp-content/uploads/2023/06/LKPOT60002-2.jpg",,,,,,,,,0,,Cookware Material,Enameled Cast Iron Cookware,0,1,,6,pumpkin dutch oven,160,10414,no,,Enameled Cast Iron Pumpkin Dutch Oven Wholesale LKPOT60002,"Seasonal pumpkin-shaped enameled cast iron Dutch oven for bulk orders. Durable, even heat, induction safe. Order wholesale today."
10491,simple,,,Enameled Cast Iron Braiser LKPOT60003,1,0,visible,"<h3>Key Features</h3><ul><li><strong>Low Profile Design:</strong> Wide surface area perfect for searing and browning meats.</li><li><strong>Enameled Cast Iron:</strong> Provides superior heat retention and even cooking.</li><li><strong>Versatile Use:</strong> Oven-safe and compatible with all stovetops, including induction.</li></ul>","<h2>Enameled Cast Iron Braiser LKPOT60003</h2><p>This enameled cast iron braiser is a must-have for professional kitchens and cookware retailers. Its wide, low profile maximizes surface area for browning, searing, and simmering, making it ideal for sauces, braises, and one-pot meals. The enamel coating ensures easy food release and quick cleanup, while the cast iron construction delivers consistent heat distribution for precise cooking. A tight-fitting lid locks in moisture, enhancing flavors in bulk preparations. Compatible with all cooktops, including induction, and oven-safe for finishing dishes, this braiser offers exceptional versatility. The sturdy side handles provide a secure grip, and the durable finish resists chipping and staining. Available in wholesale quantities, this product is perfect for stocking high-demand kitchen accessories. Its professional-grade build appeals to restaurant supply stores and distributors seeking reliable cookware. Elevate your inventory with a braiser that combines performance with lasting durability.</p><h3>Key Features</h3><ul><li><strong>Wide Base:</strong> Ideal for searing and browning large portions.</li><li><strong>Enamel Finish:</strong> Non-reactive and easy to maintain.</li><li><strong>Induction Compatible:</strong> Works on all stovetop types.</li></ul><h3>Specifications</h3><table><tr><th>Spec</th><th>Detail</th></tr><tr><td>Material</td><td>Enameled Cast Iron</td></tr><tr><td>Oven Safe</td><td>Up to 500°F</td></tr><tr><td>Stovetop Compatibility</td><td>All types including induction</td></tr><tr><td>Shape</td><td>Low profile, wide</td></tr></table>",,,taxable,,1,,,0,0,,,,,0,,,,Cookware > Pots,,,"https://img.leeknives.com/wp-content/uploads/2023/06/Enameled-Cast-Iron-Braiser-LKPOT60003.jpg, https://img.leeknives.com/wp-content/uploads/2023/06/LKPOT60003-1.jpg, https://img.leeknives.com/wp-content/uploads/2023/06/LKPOT60003-2.jpg, https://img.leeknives.com/wp-content/uploads/2023/06/LKPOT60003-3.jpg, https://img.leeknives.com/wp-content/uploads/2023/06/LKPOT60003-4.jpg",,,,,,,,,0,,Cookware Material,Enameled Cast Iron Cookware,0,1,,6,cast iron braiser,160,10414,no,,Enameled Cast Iron Braiser Wholesale LKPOT60003,"Professional enameled cast iron braiser for bulk orders. Wide base for searing, induction safe. Durable and easy to clean. Order wholesale today."
10498,simple,,,Cast Iron Dutch Oven LKPOT60004,1,0,visible,"<h3>Key Features</h3><ul><li><strong>Bare Cast Iron:</strong> Provides superior heat retention and natural nonstick seasoning.</li><li><strong>Durable Construction:</strong> Built to last for heavy-duty commercial use.</li><li><strong>Versatile Cooking:</strong> Suitable for oven, stovetop, campfire, and grill.</li></ul>","<h2>Cast Iron Dutch Oven LKPOT60004</h2><p>This classic cast iron Dutch oven is designed for wholesale buyers seeking durable, high-performance cookware. The bare cast iron construction develops a natural nonstick seasoning over time, making it ideal for slow-cooking, baking, frying, and roasting. Its thick walls and tight-fitting lid trap heat and moisture, ensuring tender results for bulk meals. Compatible with all heat sources, including induction, ovens, and open flames, this Dutch oven is a versatile addition to any kitchen. The sturdy side handles provide a secure grip, even with oven mitts. Available in wholesale quantities, this pot is perfect for retailers, restaurants, and outdoor cooking enthusiasts. Its timeless design and robust build ensure long-lasting performance, making it a staple for commercial and home kitchens alike. Stock this essential cookware to meet the demands of customers seeking reliable, traditional cooking tools.</p><h3>Key Features</h3><ul><li><strong>Bare Cast Iron:</strong> Develops natural nonstick seasoning with use.</li><li><strong>Even Heating:</strong> Eliminates hot spots for consistent cooking.</li><li><strong>Multi-Heat Compatible:</strong> Works on stovetop, oven, and campfire.</li></ul><h3>Specifications</h3><table><tr><th>Spec</th><th>Detail</th></tr><tr><td>Material</td><td>Cast Iron (bare)</td></tr><tr><td>Oven Safe</td><td>Yes</td></tr><tr><td>Stovetop Compatibility</td><td>All types including induction</td></tr><tr><td>Lid</td><td>Tight-fitting cast iron</td></tr></table>",,,taxable,,1,,,0,0,,,,,0,,,,Cookware > Pots,,,"https://img.leeknives.com/wp-content/uploads/2023/06/Cast-Iron-Dutch-Oven-LKPOT60004.jpg, https://img.leeknives.com/wp-content/uploads/2023/06/LKPOT60004-2.jpg, https://img.leeknives.com/wp-content/uploads/2023/06/LKPOT60004-1.jpg",,,,,,,,,0,,Cookware Material,Cast Iron Cookware,0,1,,6,cast iron dutch oven,160,10414,no,,Cast Iron Dutch Oven Wholesale LKPOT60004,"Classic bare cast iron Dutch oven for bulk orders. Durable, even heat, multi-heat compatible. Order wholesale today."
10503,simple,,,Cast Iron Oval Dutch Oven LKPOT60005,1,0,visible,<h3>Key Features</h3><ul><li><strong>Oval Shape:</strong> Accommodates larger roasts and poultry for versatile cooking.</li><li><strong>Bare Cast Iron:</strong> Ensures excellent heat retention and natural seasoning.</li><li><strong>Heavy-Duty Build:</strong> Designed for commercial use and outdoor cooking.</li></ul>,"<h2>Cast Iron Oval Dutch Oven LKPOT60005</h2><p>This oval cast iron Dutch oven is a versatile addition to any wholesale cookware inventory. Its elongated shape is perfect for cooking whole chickens, roasts, and larger cuts of meat, making it a favorite among professional chefs and home cooks. The bare cast iron construction provides superior heat retention and even distribution, while developing a natural nonstick seasoning over time. Compatible with all heat sources, including induction, ovens, and campfires, this pot is ideal for both indoor and outdoor cooking. The tight-fitting lid locks in moisture and flavor, ensuring tender results for stews, soups, and braises. Sturdy side handles offer a secure grip, even when hot. Available in bulk quantities, this Dutch oven is perfect for retailers, restaurant supply stores, and distributors. Its durable build and practical design make it a reliable choice for high-volume cooking environments.</p><h3>Key Features</h3><ul><li><strong>Oval Design:</strong> Fits larger roasts and poultry comfortably.</li><li><strong>Seasoned Finish:</strong> Natural nonstick surface improves with use.</li><li><strong>Multi-Heat Use:</strong> Suitable for stovetop, oven, and grill.</li></ul><h3>Specifications</h3><table><tr><th>Spec</th><th>Detail</th></tr><tr><td>Material</td><td>Cast Iron (bare)</td></tr><tr><td>Shape</td><td>Oval</td></tr><tr><td>Oven Safe</td><td>Yes</td></tr><tr><td>Stovetop Compatibility</td><td>All types including induction</td></tr></table>",,,taxable,,1,,,0,0,,,,,0,,,,Cookware > Pots,,,"https://img.leeknives.com/wp-content/uploads/2023/06/Cast-Iron-Oval-Dutch-Oven-LKPOT60005.jpg, https://img.leeknives.com/wp-content/uploads/2023/06/LKPOT60005-1.jpg, https://img.leeknives.com/wp-content/uploads/2023/06/LKPOT60005-2.jpg",,,,,,,,,0,,Cookware Material,Cast Iron Cookware,0,1,,6,oval dutch oven,160,10414,no,,Cast Iron Oval Dutch Oven Wholesale LKPOT60005,"Oval cast iron Dutch oven for bulk orders. Perfect for roasts, even heat, multi-heat compatible. Order wholesale today."
10508,simple,,,Cast Iron Camp Dutch Oven LKPOT60006,1,0,visible,<h3>Key Features</h3><ul><li><strong>Camp-Ready Design:</strong> Built for outdoor cooking over coals or campfires.</li><li><strong>Bare Cast Iron:</strong> Provides durability and natural nonstick seasoning.</li><li><strong>Legs and Lid:</strong> Integrated legs for stability and a flanged lid for holding coals.</li></ul>,"<h2>Cast Iron Camp Dutch Oven LKPOT60006</h2><p>This cast iron camp Dutch oven is designed for outdoor cooking enthusiasts and wholesale buyers supplying camping gear. Featuring three integrated legs for stable placement over coals and a flanged lid that holds hot coals for even top heat, it is ideal for baking, stewing, and frying in the wilderness. The bare cast iron construction ensures excellent heat retention and develops a natural nonstick seasoning over time. Its sturdy wire handle allows for easy suspension over a fire or transport. Compatible with campfires, charcoal, and stovetops, this versatile pot is a staple for outdoor kitchens. Available in wholesale quantities, it is perfect for retailers targeting campers, hunters, and outdoor cooking fans. The durable build withstands rugged conditions, making it a long-lasting addition to any cookware collection. Stock this essential for customers who demand reliability in the great outdoors.</p><h3>Key Features</h3><ul><li><strong>Three Legs:</strong> Provides stability over coals or campfires.</li><li><strong>Flanged Lid:</strong> Holds coals for even top-down heating.</li><li><strong>Wire Handle:</strong> Easy to carry or hang over fire.</li></ul><h3>Specifications</h3><table><tr><th>Spec</th><th>Detail</th></tr><tr><td>Material</td><td>Cast Iron (bare)</td></tr><tr><td>Legs</td><td>3 integrated legs</td></tr><tr><td>Lid</td><td>Flanged for coals</td></tr><tr><td>Handle</td><td>Wire handle</td></tr></table>",,,taxable,,1,,,0,0,,,,,0,,,,Cookware > Pots,,,"https://img.leeknives.com/wp-content/uploads/2023/06/Cast-Iron-Camp-Dutch-Oven-LKPOT60006.jpg, https://img.leeknives.com/wp-content/uploads/2023/06/LKPOT60006-3.jpg, https://img.leeknives.com/wp-content/uploads/2023/06/LKPOT60006-1.jpg, https://img.leeknives.com/wp-content/uploads/2023/06/LKPOT60006-2.jpg, https://img.leeknives.com/wp-content/uploads/2023/06/LKPOT60006-4.jpg",,,,,,,,,0,,Cookware Material,Cast Iron Cookware,0,1,,10,camp dutch oven,160,10414,no,,Cast Iron Camp Dutch Oven Wholesale LKPOT60006,Camp-ready cast iron Dutch oven for bulk orders. Legs and flanged lid for outdoor cooking. Order wholesale today.
10518,simple,,,Cast Iron Oval Double Dutch Oven LKPOT60007,1,0,visible,"<h3>Key Features</h3><ul><li><strong>Oval Double Design:</strong> Two-in-one pot with a lid that doubles as a skillet.</li><li><strong>Bare Cast Iron:</strong> Exceptional heat retention and natural seasoning.</li><li><strong>Versatile Use:</strong> Ideal for roasting, frying, and baking.</li></ul>","<h2>Cast Iron Oval Double Dutch Oven LKPOT60007</h2><p>This oval double Dutch oven offers two-in-one functionality, making it a valuable addition to any wholesale cookware lineup. The deep pot is perfect for stews, soups, and braises, while the lid flips over to serve as a skillet for frying or searing. Constructed from bare cast iron, it delivers superior heat retention and develops a natural nonstick seasoning with use. Its oval shape accommodates larger cuts of meat, and the tight-fitting lid locks in moisture for tender results. Compatible with all heat sources, including induction and ovens, this versatile pot is ideal for both indoor and outdoor cooking. Sturdy side handles provide a secure grip, even when hot. Available in bulk quantities, this Dutch oven is perfect for retailers, restaurant suppliers, and distributors. Its dual-purpose design appeals to customers seeking space-saving cookware without compromising performance.</p><h3>Key Features</h3><ul><li><strong>Dual Function:</strong> Pot and skillet in one design.</li><li><strong>Oval Shape:</strong> Fits large roasts and poultry.</li><li><strong>Durable Cast Iron:</strong> Built for heavy-duty use.</li></ul><h3>Specifications</h3><table><tr><th>Spec</th><th>Detail</th></tr><tr><td>Material</td><td>Cast Iron (bare)</td></tr><tr><td>Shape</td><td>Oval</td></tr><tr><td>Lid Function</td><td>Converts to skillet</td></tr><tr><td>Oven Safe</td><td>Yes</td></tr></table>",,,taxable,,1,,,0,0,,,,,0,,,,Cookware > Pots,,,"https://img.leeknives.com/wp-content/uploads/2023/06/Cast-Iron-Oval-Double-Dutch-Oven-LKPOT60007.jpg, https://img.leeknives.com/wp-content/uploads/2023/06/LKPOT60007-2.jpg, https://img.leeknives.com/wp-content/uploads/2023/06/LKPOT60007-1.jpg, https://img.leeknives.com/wp-content/uploads/2023/06/LKPOT60007-3.jpg",,,,,,,,,0,,Cookware Material,Cast Iron Cookware,0,1,,7,double dutch oven,160,10414,no,,Cast Iron Oval Double Dutch Oven Wholesale LKPOT60007,"Oval double Dutch oven for bulk orders. Pot and skillet in one, even heat, durable. Order wholesale today."
10524,simple,,,Cast Iron Dutch Oven with Bail LKPOT60008,1,0,visible,<h3>Key Features</h3><ul><li><strong>Bail Handle:</strong> Wire handle for easy hanging or carrying over fire.</li><li><strong>Bare Cast Iron:</strong> Ensures even heat and natural seasoning.</li><li><strong>Campfire Ready:</strong> Perfect for outdoor cooking and camping.</li></ul>,"<h2>Cast Iron Dutch Oven with Bail LKPOT60008</h2><p>This cast iron Dutch oven with a bail handle is designed for outdoor cooking and wholesale buyers serving the camping market. The sturdy wire bail handle allows for easy suspension over a campfire or transport, making it ideal for stews, soups, and baking in the wilderness. The bare cast iron construction provides excellent heat retention and develops a natural nonstick seasoning over time. Its tight-fitting lid traps moisture and flavor, ensuring delicious results for bulk meals. Compatible with campfires, charcoal, and stovetops, this versatile pot is a favorite among campers and outdoor enthusiasts. Available in wholesale quantities, it is perfect for retailers, outdoor gear stores, and distributors. The durable build withstands rugged conditions, offering long-lasting performance. Stock this essential cookware to meet the demands of customers seeking reliable outdoor cooking solutions.</p><h3>Key Features</h3><ul><li><strong>Bail Handle:</strong> Wire handle for hanging over fire.</li><li><strong>Natural Seasoning:</strong> Develops nonstick surface with use.</li><li><strong>Multi-Heat Use:</strong> Works on campfire, stove, and oven.</li></ul><h3>Specifications</h3><table><tr><th>Spec</th><th>Detail</th></tr><tr><td>Material</td><td>Cast Iron (bare)</td></tr><tr><td>Handle</td><td>Bail wire handle</td></tr><tr><td>Lid</td><td>Tight-fitting cast iron</td></tr><tr><td>Oven Safe</td><td>Yes</td></tr></table>",,,taxable,,1,,,0,0,,,,,0,,,,Cookware > Pots,,,"https://img.leeknives.com/wp-content/uploads/2023/06/Cast-Iron-Dutch-Oven-with-Bail-LKPOT60008.jpg, https://img.leeknives.com/wp-content/uploads/2023/06/LKPOT60008-2.jpg, https://img.leeknives.com/wp-content/uploads/2023/06/LKPOT60008-3.jpg, https://img.leeknives.com/wp-content/uploads/2023/06/LKPOT60008-1.jpg",,,,,,,,,0,,Cookware Material,Cast Iron Cookware,0,1,,6,dutch oven with bail,160,10414,no,,Cast Iron Dutch Oven with Bail Handle Wholesale LKPOT60008,"Cast iron Dutch oven with bail handle for bulk orders. Perfect for campfire cooking, even heat. Order wholesale today."
10530,simple,,,Cast Iron Dutch Oven LKPOT60009,1,0,visible,<h3>Key Features</h3><ul><li><strong>Classic Round Design:</strong> Traditional shape for versatile cooking applications.</li><li><strong>Bare Cast Iron:</strong> Superior heat retention and natural nonstick seasoning.</li><li><strong>Heavy-Duty Construction:</strong> Built for commercial and home use.</li></ul>,"<h2>Cast Iron Dutch Oven LKPOT60009</h2><p>This round cast iron Dutch oven is a timeless essential for any wholesale cookware collection. Its classic design is perfect for slow-cooking, braising, baking, and frying, making it a versatile tool for professional and home kitchens. The bare cast iron construction ensures exceptional heat retention and even distribution, while developing a natural nonstick seasoning over time. The tight-fitting lid locks in moisture and flavor, producing tender results for stews, soups, and roasts. Compatible with all heat sources, including induction, ovens, and campfires, this Dutch oven offers unmatched versatility. Sturdy side handles provide a secure grip, even when hot. Available in bulk quantities, it is ideal for retailers, restaurant supply stores, and distributors. Its durable build and classic appeal make it a reliable choice for customers seeking high-quality cookware. Stock this essential to meet the demands of both home cooks and culinary professionals.</p><h3>Key Features</h3><ul><li><strong>Round Shape:</strong> Classic design for even heating.</li><li><strong>Natural Seasoning:</strong> Improves nonstick performance over time.</li><li><strong>Multi-Heat Compatible:</strong> Suitable for all cooking environments.</li></ul><h3>Specifications</h3><table><tr><th>Spec</th><th>Detail</th></tr><tr><td>Material</td><td>Cast Iron (bare)</td></tr><tr><td>Shape</td><td>Round</td></tr><tr><td>Oven Safe</td><td>Yes</td></tr><tr><td>Stovetop Compatibility</td><td>All types including induction</td></tr></table>",,,taxable,,1,,,0,0,,,,,0,,,,Cookware > Pots,,,"https://img.leeknives.com/wp-content/uploads/2023/06/Cast-Iron-Dutch-Oven-LKPOT60009.jpg, https://img.leeknives.com/wp-content/uploads/2023/06/LKPOT60009-1.jpg, https://img.leeknives.com/wp-content/uploads/2023/06/LKPOT60009-5.jpg, https://img.leeknives.com/wp-content/uploads/2023/06/LKPOT60009-2.jpg, https://img.leeknives.com/wp-content/uploads/2023/06/LKPOT60009-3.jpg, https://img.leeknives.com/wp-content/uploads/2023/06/LKPOT60009-4.jpg",,,,,,,,,0,,Cookware Material,Cast Iron Cookware,0,1,,6,cast iron dutch oven,160,10414,no,,Cast Iron Dutch Oven Round Wholesale LKPOT60009,"Classic round cast iron Dutch oven for bulk orders. Even heat, durable, multi-heat compatible. Order wholesale today."
